review,label
misi om numpang nih klo shock satria fu wat motor mes ga bos mohon jwabannya bos brng x yg tau solusi,0
brenti susah starter bensin,0
kalo motor susah diidupin stang gitu ya eh,1
kali rem dadak bunya jedag jedug libas lubang jalan kasar cepat,0
ban motor retak,0
cat motor bagus mana ya,0
sy mw gmana ya baik jeglengan dah mio yg rusak los y cz ni staternya g jd ni g nyala dah,1
cat motor bagus merk ya cat nya,0
mesin brebet mati,1
gimana biar motor sehat hrus service,1
jln pelan brebet tp kl cepat,1
kmpas rem kmpas kopling sudh d ganti mlh kipas ny jg d ganti aneh sakit ga smbuh mlh tmbah parah mesin nya ka,1
hidup aman aman jalan pasang gigi aman aman pasang gigi km h kaya suara bunyi yg gak enak d dengar mesin,1
stang motor berat belah,0
suruh lokasi mesin mati total nih,1
kampas rem lengket,0
